Hotel,https://www.tripadvisor.com/ShowUserReviewsg32117d4507733r283666128CollinsLakeRecreationAreaBrownsValleyCalifornia.html,Date of stay: June 2015,Collins Lake Recreation Area,United States,California CA,Browns Valley,unknown,Doesn't enforce rules lets loud people keep everyone up until 3:00AM,"We decided to take our four boys camping for the weekend and we were excited about visiting Collin's Lake for the first time. We had read other rebiews about loud campers but didn't think it would be a big issue. It was! Our neighbors a large group shined a bright light into our tent, yelled and played loud music until past 3:00 AM. When they were asked to be quiet, they laughed. It took until 2:00 AM for any park employee to come out. After he left they used racial slurs, cursed and said they were going to get their money's worth. He came again after 3:00 AM. They laughed about him getting overtime. Nothing was done. We complained the next day and were offered a new site. We declined and left. We talked to a dad at the playground who had a similar issue on the other side of camp. Apparently it seems to be a known thing that you can be loud, rude and inconsiderate and nothing happens. This creates bigger issues. Also dogs on the beach in the swim area when the sign clearly said no pets. Three employees walked by and didn't enforce. Once again, people will do whatever if rules aren't enforced. Will never go again and will tell everyone not to go. But don't worry the people that are rude will keep coming back and bring lots of friends."
Hotel,https://www.tripadvisor.com/ShowUserReviewsg293732d1019409r649708758IbisCasablancaCityCenterCasablancaGrandCasablancaRegion.html,Date of stay: January 2019,Ibis Casablanca City Center,Africa,Morocco,Grand Casablanca Region,"Jeddah, Saudi Arabia",Terrible service.,"The service in this hotel is horrible! Just avoid it in the future as there are so many choices nearby. The front desk guys were cold and impatient. They refused to recognize my silver status membership; we were charged extras without shown any official receipt I filed a complaint to Accor but still have not received the receipt after 3 weeks.; they offered cash exchange service but refused to change even only 200USD for us. When we were leaving negative comments in Booking.com, we were shocked to find out that the hotel is notorious for providing poor service and overcharging especially towards Asians China, Japan, Korea, Malaysia, etc.. I guess racial discrimination is the worst comment that a hotel could ever receive."
Hotel,https://www.tripadvisor.com/ShowUserReviewsg29734d98399r568543971TravelodgebyWyndhamAbseconAtlanticCityAbseconNewJersey.html,Date of stay: March 2018,Travelodge by Wyndham Absecon Atlantic City,United States,New Jersey NJ,Jersey Shore,unknown,Do not stay here!,"The night we checked in, we went to our room. The elevator looked old and buttons were broken.  Our floor smelled like smoke.  The door to our room did not seem secure. The lock was loose.  The room smelled like mold and the carpet had weird stains. The faucets were rusted.  Even though we were in a non smoking floor, the bathtub had cigarette stains on it.  There is a microwave in the room however looked like it was just thrown in to cover a hole. It was even unplugged and when we went to plug it, the plug wouldnt reach the wall.  We had to take it down, put it on the floor so we could plug it while we heated up some food. The so called gym was a total joke. The elpticas machine had wires coming out of it and the plastic cover for the motor was broken and in the floor. The Nautilus machine had all the cables and pulleys broken on the floor. The next morning we had an eh breakfast.  Coffee tasted like dirty water. There were dead flies on the floor by the window. As we went back to the room, I saw a guest causing a commotion yelling and cursing at the clerk with racial connotations which scared my kids. I thought to myself, what kind of people stay here Well from this experience, very questionable people at best.  The overall cleanliness of the hotel is poor. The overall cleanliness of the room is poor. We sucked it up because it was only 2 nights and there was no vacancy elsewhere. Will NOT stay here ever again."
Hotel,https://www.tripadvisor.com/ShowUserReviewsg303881d3827171r188855384JohnsCottageHomestayMunnarIdukkiDistrictKerala.html,Date of stay: December 2013,John's Cottage Homestay,Asia,India,Kerala,"Auckland Central, New Zealand",Owner aggressive and frightening,"I travelled to Munnar with my Mum in October and we were dropped off at John's Cottage, with no reservation. We decided we didn't want to stay as the room was damp and dank and immediately John and his friend became extremely angry, and verbally abusive towards us. John is a large man and stood in the doorway to prevent us leaving and demanded full payment even though we had not reserved. He was aggressive, intimidating, coming close up to us and would not let us leave without paying. Even after paying we had no choice he continued to shout abuse including racial abuse. As two female travellers we felt frightened by John and fearful for our safety."
Hotel,https://www.tripadvisor.com/ShowUserReviewsg186394d8457485r420067181BudgetHostelNewcastleuponTyneTyneandWearEngland.html,Date of stay: September 2016,Budget Hostel,Europe,United Kingdom UK,England,"Burnley, United Kingdom",Disgusting!!!!,"What an absolute disgusting place off a hell hole.. The staff were rude, some of us suffered racial abuse from staff.. We had a rat in of the rooms, the best sheets had only what i could describe as seamen on them... Avoid at all cost! Would rather sleep in a tent in syria"
Hotel,https://www.tripadvisor.com/ShowUserReviewsg673348d6621025r227364975ApartahotelSanMarinoSantJosepdeSaTalaiaIbizaBalearicIslands.html,Date of stay: September 2014,Apartahotel San Marino,Europe,Spain,Balearic Islands,unknown,"DO NOT STAY HERE , WORST PLACE",Went on holiday with a few friends and were greeted with rude staff that could speak English but decided to mutter in Spanish with their colleagues. The room sizes are reasonable however air condition was terrible . The cleaners refused to clean our rooms and we were provided with dirty plates to eat with. Staff were very disrespectful and did not like to help us on activities they had running. Breakfast was finished every morning by 9.30pm. Wifi is NOT available they lied and said it is. Staff also made a lot if racial comments . Please be aware of this hotel and do not stay there are many hotels 10 minutes away who care fir you and also help you.
Hotel,https://www.tripadvisor.com/ShowUserReviewsg29533d95127r622477900Super8byWyndhamAdrianAdrianMichigan.html,Date of stay: September 2018,Super 8 by Wyndham Adrian,United States,Michigan MI,Adrian,unknown,GM double charged me because she did not like our original rate. Girl on the accidentally cancelled our reservation.,"Thank god for the front desk manager, Erik, insuring we had a room and fixing the problem. I even overheard the GM using several racial slurs. Lobby was dirty every time we walked through. WILL NOT BE STAYING AGAIN"
Hotel,https://www.tripadvisor.com/ShowUserReviewsg33871d224357r572959376HiltonGardenInnNorwalkNorwalkConnecticut.html,Date of stay: April 2018,Hilton Garden Inn Norwalk,United States,Connecticut CT,Norwalk,NY,"Would stay again to escape the city, just not for breakfast","The lobby of this location is very warm and welcoming with complimentary water and coffee and a real working fire place. We were there for 2 nights. Staff was mostly courtesy, our room was very clean and spacious, we picked a corner room on the Hilton app. The only issue I had with the room is the outer curtains didn't close all the way and inner curtains were veil thin so there still light from the streets coming in and then the sun in the morning. Still had a few good nights of sleep. Bed was comfortable as you can adjust the firmness and temperature control was steady.We had breakfast there our first morning, we waited to be seated for a few minutes and asked a staff member if we should seat ourselves. They showed us to a table and explain it was a buffet style, also they weren't our server. The food choices were little to choose from, they had some made to order items. Not being hopeful, I asked if they had turkey bacon, they didn't but had turkey sausage I was pleasantly surprised. Made to order items will be brought to your table. We saw our server twice to bring utensils and the made to order food, then she disappeared. We manage to get a cup of ice from her since I wanted ice coffee and it at first seemed selfserved. We heard her asked everyone else if they wanted coffee or water and the were brought mugs and glasses. We were never asked. Kind of put off by that, we kept getting up to get our own water and coffee at the self service welcome station with paper cups until they ran out of coffee at 10 am...mind you this was only the self serving kind. We were advised by another employee it would be refilled and to ask our server for more coffee. When we finally got our server's attention for water and coffee, she only brought out 1 water and coffee and ran off. There were two of us... my husband went to the buffet and had chocolate milk until we Overall the food and coffee were decent we both enjoyed our own pork and turkey sausage but the service needs to be work on. I'm not sure why we received poor service; the only differences between us and other tables with couples were we were a younger couple and a biracial one. I am not claiming bias as my husband is the same race as the server, honestly, our server just seemed lost in space but it doesn't account for her being attentive to the other tables and not us.I didn't use any of the other amenities like the pool working, business center or gym. We had a few drinks at the bar both nights. They were good and reasonable price, however some garnish would've been nice for my cocktail. Also, they had Cruzan rum listed on the menu but only carried two other standard rums. I wish they would update their menu as no reason was offer why they didn't have it. The bar area is very small so most guests were making use of the lobby seating and breakfast tables, it made for a cozy and comfortable atmosphere. I would stay here again, however we would take our chances crossing the busy road to have breakfast at Starbucks or go further into town and eat at a cafe like we did the second morning."
Hotel,https://www.tripadvisor.com/ShowUserReviewsg37209d224832r505525083HolidayInnExpressSuitesIndianapolisNorthwestIndianapolisIndiana.html,Date of stay: July 2017,Holiday Inn Express  Suites Indianapolis Northwest,United States,Indiana IN,Indianapolis,"Westerville, Ohio","Clean, decent accommodations.",O my 1 waffle maker.  Pic shows two.  One tray of scrambled eggs and sausage patties.  There wasn't enough room for everyone and there was a group of teenage boys hovering around the food and hogging the 1 waffle maker.  Their language was offensive and racial slurs were being dropped making guests uncomfortable.  They were African American dropping the n word at eachother.  The breakfast area could use another waffle maker and tray of eggs and sausage for the number of guests who were staying there.  Wait time did not permit several people to take advantage of the free breakfast which is taken I to consideration when booking a hotel.  Just drop the breakfast and lower your price by 20 bucks and it would cut your expenses and provide a better stay experience for your guests.
Hotel,https://www.tripadvisor.com/ShowUserReviewsg1066443d1235856r624142687ShangriLaHotelTokyoChiyodaTokyoTokyoPrefectureKanto.html,Date of stay: October 2018,"ShangriLa Hotel, Tokyo",Asia,Japan,Kanto,unknown,Overpriced nothing,I vacation a lot. I have spent many months in city around the world. This place was the largest rip off I have come across. Everything is over priced and not good. Breakfast buffet was a total rip. The worse show of using a big name for overcharging guests. Many staff could not speak English which is disappointing. I am North American and found this hotel to have a racial component as well. Seemed a bit that all of Japan did. I just didnt expect it at my hotel. Ordered our 25 bar drinks after waiting for 15 mins just to wait another 20 mins to get it. However some Japanese guests treated instantly. We looked presentable and did not cause trouble. Were just North American. Our room was facing the train tracks so loud all day. The 2 elevator systems sucks if you want to enjoy the outside and come back in. The gym is very small. Location is good that thats going for them.
Hotel,https://www.tripadvisor.com/ShowUserReviewsg1010240d2322731r654043275DunesHolidayVillageMandremNorthGoaDistrictGoa.html,Date of stay: February 2019,Dunes Holiday Village,Asia,India,Goa,"Mumbai, India",Stop by for a tasty dinner and a bit of racism if you're Indian,"Leaving this for the restaurant as opposed to the resort as a whole, though if this is the way the restaurant staff are, then I suppose the resort can't be far behind. Always a good reminder, that even in 2019, in this part of Goa, people just don't know how to treat people decently, and more importantly  professionally.I stayed a couple of nights in Mandrem, and went to Dunes for dinner on both nights. It wasn't too busy on the first night, and though the staff was fairly surly I just assumed they were always like that, I received my order quickly, and it was tasty.I came back the second night, and it was a lot busier. I had to wait to be seated, and though they had a few tables open in the back section, I wanted to sit in the front by the sea. A table right by the front became available after a few minutes, and the waiter indicated that I should go and sit there, and said that he would be with me shortly.As I was walking towards my table, I saw a young, foreign couple get up from their table towards the back and start rushing towards the empty table that was supposed to be mine. They got there a second after I did, and the girl grabbed the chair and squeezed past me to try and sit down. It was absurd that they were behaving that desperately in the first place, but I calmly said to her that this was my table. She responded by saying that they'd been wanting to sit there, and I merely said that I'd been waiting, and this is where I'd been seated.By this time the waiter had arrived at the table, and when confronted by a scene where he presumably had to choose between pleasing a slightly unreasonable foreign couple, or doing his duty and seating his Indian customer, he chose the former.He motioned with his hand towards the table that they'd just vacated, and said ""go sit over there"" in Hindi, and gave them the table at the front.I contemplated making a scene, but decided not to go through the trouble of doing so, since sorting this out was their responsibility and not mine. Giving the couple the benefit of the doubt, I asked the waiter if perhaps they had put their names down and asked to move tables earlier, but he confirmed that no, they hadn't. I asked him on what basis he gave them the table over me, and he shrugged and said ""what do you want me to do"".At this point, I told him that it was pretty clear where his ideals were, and he just smirked and walked off. I left the restaurant feeling quite sickened and upset at being treated like this  I honestly don't know why this kind of thing still happens. It's a beach shack in Mandrem after all, so it's not like spending power is really a factor here.I called the place later, and made a complaint to the management. They barely bothered to listen to the call, and ended it saying they would pass my ""feedback"" on. I'm pretty sure that went nowhere."
Hotel,https://www.tripadvisor.com/ShowUserReviewsg1021352d1122203r640521652LotteAraiResortMyokoNiigataPrefectureKoshinetsuChubu.html,Date of stay: October 2018,Lotte Arai Resort,Asia,Japan,Chubu,unknown,Racism,I am extremely disappointed to share my experience of the racism at lotte Arai hotel. My family is of mixed nationality and as we were leaving the onsen we heard the front desk receptionists remark that they hate gaijin. I was shocked by their blatant rasict remark and deeply saddened  by this. My family and I have supported Arai from its reopening and have shared some memorable family milestones there.  With this type of remark it is hard for us to feel welcome and to suppprt such an organization that allows open racism. Deeply disappointed .
Hotel,https://www.tripadvisor.com/ShowUserReviewsg1080252d260911r636251767IbisMarneLaValleeEmerainvilleEmerainvilleMarnelaValleeSeineetMarneIl.html,Date of stay: November 2018,Ibis Marne La Vallee Emerainville,Europe,France,IledeFrance,unknown,Racism  Discrimination,"We put a group to Ibis Marne La Vallee Emerainville  we had a very terrible experience.Whole group stayed at 3rd floor without lift service average 60  80 years old  there was no portage service either. Initially they said will ask 3 people to help but at the end only one man was there but that man said I have to look after reception could not help thus eventually elderly have to bring their own baggage up to their room. Next day morning, everyone happily coming down for breakfast and another nightmare happened.They have been told to have breakfast at a room which did not have food then our tour leader asked staff for help but no one help or not even care about them. No choice we decided to ask all our clients to join FIT breakfast.Manager Melanie is very rude, racism  discrimination. Staff at the FIT restaurant only bring food for FIT guess and ignore our clients. They said our clients scare away their FIT clients.Melanie shout at our group and she said we don't want your group in my hotel, get out.They are terrible!"
Hotel,https://www.tripadvisor.com/ShowUserReviewsg1152294d1152299r606275398FourSeasonsResortMauritiusatAnahitaBeauChamp.html,Date of stay: August 2018,Four Seasons Resort Mauritius at Anahita,Africa,Mauritius,Flacq District,"Dubai, United Arab Emirates","""Racism is acceptable at the resort""","One of the main reasons why we always choose four seasons when we travel is safety and security in the hotel. However, compared to other four seasons branches the resort in Mauritius seemed more like a 3 star hotel in terms of ethical standards and service. We had an incident where we were subject to a racist attack and verbal abuse by a couple at the beach because they wanted to sit on the beds that we were sitting at even though all other beds around us were empty. We were three girls wearing head scarfs and the foreign couple made comments about our head scarfs, the country we come from and gave us the middle finger. The beach attendant raised the matter to the management of the resort as he seemed genuinely concerned about us. However, the statements made by the resort management once they became aware of the incident were very sad and alarming. The front desk manager stated the following ""the couple's behavior is not a breach of any law in Mauritius and the resort can't do anything about it"", ""the guy is from Italy and giving hand gestures is something normal"" and ""only if there was physical abuse then we can take action against it"". Further, they assured us that we will not encounter the couple for the rest of our stay at the resort but nothing was done by the resort. We have encountered the same couple at every restaurant we had breakfast and dinner at. The resort became a very hostile environment for us following the incident. I don't think the staff at the resort understand the magnitude of racism as they tried to offer us spa treatment to ""forget about what happened"". The code of ethics available on the four seasons website clearly states that verbal abuse will not be tolerated. But, their own staff don't uphold any of the integrity and ethical standards mentioned under their own code. Nowadays, even small shops that are desperate for business take firm actions against racism by reporting it to authorities and refusing to host racist people and a 5 star resort like four seasons decided to tolerate racism and do nothing about the matter."
Hotel,https://www.tripadvisor.com/ShowUserReviewsg1189030d3659056r277934435SouthBeachResortKoggalaGalleDistrictSouthernProvince.html,Date of stay: July 2014,South Beach Resort,Asia,Sri Lanka,Southern Province,"Las Vegas, Nevada",Amil K. is worng!,"The review written by Amil K. does not relate to reality and what could have happened. As a former travel executive I could vouch that Amil K. is wrongfully referring to the world wide policy of hotels allowing only guests to use the pool. Hotels all over the world from Las Vegas strip to Maldives use this policy to provide privacy for their guests. Amil K. must have attempted to use the hotel pool and was told that the pool is only for guests. People from Sri Lanka are very friendly and kind. They even do not have a word or term for racism in common use Sinhala language. I am not going to believe a hospitality industry worker from Sri Lanka would make such a comment even in private. But Amil K would like me to believe that the receptionist made such a comment to the face of the race that she was offending.The receptionist in question has the skin color of brown or black! Amil K. states that she is being racist to her own race If that is the case that is not racism. Amil K. has arguments that are horribly poor. Just like his spelling. I am going to be visiting Sri Lanka again soon and will make it a point to stay at this beautiful hotel. Furthermore, since I am going to be a hotel guest that will not mind paying my way I will be swimming in that inviting pool too."
Hotel,https://www.tripadvisor.com/ShowUserReviewsg1189030d3659056r195408060SouthBeachResortKoggalaGalleDistrictSouthernProvince.html,Date of stay: February 2014,South Beach Resort,Asia,Sri Lanka,Southern Province,"London, United Kingdom",This place is a full of racism.  Please avoid!,"This hotel is a total wast! If your skin is brown or black this not place to be. The receptionist did not hesitate to say that because you are not white, you want be able to use the swimming pool. But you are welcome to stay In the room. I feel really disappointed as a sri lankan you are treated very different from others. "
Hotel,https://www.tripadvisor.com/ShowUserReviewsg1190969d1199574r97616122AlexandrosHotelNeaKiosArgolisRegionPeloponnese.html,Date of stay: February 2011,Alexandros Hotel,Europe,Greece,Peloponnese,"Oslo, Norway",Racism residing within the bed sheets of Alexandros Hotel...,"It is the nicest hotel you'll find in Nea Kios, unfortunately, I would never return again. The rooms were beautiful and the breakfast was great but if there's one thing that I stand firmly for, it would be the understanding of different cultures and acceptance of diversity. Traveled to Nea Kios with my hockey team mates for the EuroHockey Indoor Club Champions Challenge II. The majority of my team mates are pakistani and due to their religious beliefs, they can only eat halal meat. Since Nea Kios is such a small town, there is no halal meat available so they had no option that to order food to be delivered from Athens. We all gathered in a room, moved the furniture around, laid a sheet on the ground and placed the food on top, then sat in a circle and began to eat  something that they've done several times in other hotels in countries like Serbia, Turkey, Slovakia, Bulgaria, Sweden, and Germany. Next thing we know, the owner comes in screaming in half greek half english saying it was not allowed and we were destroying his hotel. Words cannot describe my horrifying experience. His rage was unnecessary and it got to the point of being violent  he had slammed his arm against the door, broke the bed after hitting it, and almost hit one of my team mates. He eventually yelled at all of us to get out and started picking up the food and almost throwing it on the ground outside. I didn't understand what we had done was wrong.His justification for reacting so strongly was that he had spent much of his time and money into building this hotel and we were destroying his room and it wasn't allowed to gather everyone in a room and eat together. Apparently, if he had called the tourist agency, we would of been taken and placed in jail for what we did... but honestly it's complete bs. If he didn't agree with us eating there he could of went about it in a much more rational matter but this man came raging in like we had ransacked his hotel. It saddens me to say but if I had been traveling with an all white team, we would of never have been placed in this situation. I understand Greece is going through harsh financial times and with all the illegal immigrants being deported back to Greece breeds much animosity between different races but that in no way validates discrimination and racism. You cannot judge a person based on stereotypes and assumptions. I've played hockey with these men for sometime now and I know they meant no harm; it's in their culture to gather together and eat... as it is in many others.How can the we make the world be a better place if we continue to close our eyes to different cultures and give into to stereotypes rather than change them Even if this hotel was the best, it's against my morals to condone to such behavior. I'd rather have slept in a sleeping bag on the beautiful beaches of Nea Kios..."
