Hotel,https://www.tripadvisor.com/ShowUserReviewsg187323d578393r402060532Hotel103Berlin.html,Date of stay: June 2016,Hotel 103,Europe,Germany,Berlin,unknown,Very bad hotel because of a racist manager,"I stayed at this property through my program  DO school program. So, the school had made the bookings for us there due to last minute issues with flats they have generally for DO school fellows. We also had the permission to use the kitchen in the contract since we stayed there for 8 weeks. But we had a horrible experience because of the manager named Alberto. Now in this program we were 18 fellows from different countries from Asia, Africa and Latin America. And this manager made racist comments on us at every opportunity that he could avail. For example, when we would cook in the kitchen he would come and ask us where are we from and then ridicule us by commenting that 'Is this how you clean in your countries' He would make fun of our foods, saying 'Curry, curry, curry, curry, my kitchen smells of curry, why don't you make some German food' He would shout at us for no reason and say offensive things such as 'You do not have brains to understand what I am saying' And even when we would walk in corridors he would stop us and comment ' Oh, are you from Morocco, terrorists are from there!' And when we would go to ask him for internet tickets he would make us wait or make us come back and ridicule our etiquettes even when we would be perfectly well behaved. This man made our life and experience of Berlin, Germany so bad and difficult that a lot of us stopped cooking in the kitchen even when we are all social entrepreneurs and on strict budget. Our school continuously tried to communicate strictly with him but he wouldn't budge from his behaviour. It was tough for our school to shift 18 of us somewhere else in the middle of the program in peak travel season in Berlin. It made ways for us to fell better by opening the school for longer hours and giving us the keys etc. But we have resolved to take this man down as we don't want any other person to suffer like this. And please beware he is perfectly nice to Germans but selectively troubled us from other countries.Please don't stay in this hotel if you want to enjoy a super excellent place like Berlin where all the rest of the people and experiences were super duper nice."
Hotel,https://www.tripadvisor.com/ShowUserReviewsg187323d578393r399500765Hotel103Berlin.html,Date of stay: June 2016,Hotel 103,Europe,Germany,Berlin,unknown,WARNING: Not safe to live,"I've spent quiet a long time here, long enough to know whether it's an OK place to live and I'd say no it's not. I had no other choice but to stay at this hotel for 8 weeks because Berlin was full during summer 2016. This hotel wasn't my choice but we were made to stay here by our hotel.The hotel manager / owner Alberto is a racist man who bullied me and my friends throughout our stay. We used to avoid him but whenever we used to see him during evenings when we were back from work, he yelled at us and said nonsense.The hotel facilities are also not okay and I won't recommend this place."
Hotel,https://www.tripadvisor.com/ShowUserReviewsg306995d1195751r97325245SunsetCottagesCalanguteNorthGoaDistrictGoa.html,Date of stay: February 2011,Sunset Cottages,Asia,India,Goa,unknown,Complete ripoff for white people racists,"We arrived at this hotel early in the morning to be told that they only had 1 room remaining.  We only booked initially for 2 nights then a further three due to not knowing the costs of the area.  We were totally ripped off due to the colour of our skin being white.  We paid 1500 rupees per night after some haggling over the price, we than spoke with other residents who stated that they were only paying 500 rupees per night.  These were indians.  They also tried to rent us a bike for 1000 rupees per day which we found out later to be only 150 per day.  The room had A/C but was extremely basic, we found a better apartment 5 mins down the road with A/C, a swimming pool, cleaning everyday not per week with non racist management for only 500 rupees per night.  My advice is 'if you are a white tourist do not stay at Sunset cottages unless you are prepared to be taken for a ride on the racist wheel."
Hotel,https://www.tripadvisor.com/ShowUserReviewsg297549d5123245r616309974NubiaAquaBeachResortHurghadaRedSeaandSinai.html,Date of stay: August 2018,Nubia Aqua Beach Resort,Africa,Egypt,Red Sea and Sinai,unknown,VERY POOR HOTEL,AVOID THIS HOTEL AT ALL COSTS. Rude and aggressive management and poor customer service and blatantly RACIST. They wanted all the women dressed in burkinis to use the last pool only. When we refused they got angry. Absolutely appalling attitude. The rooms given were not the ones promised. The lunch and evening meal are exactly the same. There was no fresh fruit ever. The fruit provided was on the verge of going off.
Hotel,https://www.tripadvisor.com/ShowUserReviewsg297549d5123245r615972499NubiaAquaBeachResortHurghadaRedSeaandSinai.html,Date of stay: September 2018,Nubia Aqua Beach Resort,Africa,Egypt,Red Sea and Sinai,unknown,Please avoid at all cost  read all UK reviews..NOT 5,"ARROGANT RUDE STAFF We travelled as a large group and upon our arrival we were told that despite having booked and paid for 5 rooms, only 4 rooms are available. After arguing they then gave us 5 rooms that were to be changed the following day as we had booked 3 pool view rooms. Pics to follow This didn't happen either. The following day the rooms were changed but not to what we had paid for. Arguing with the staff was futile as nothing came of it. The hotel management was so poor, arrogant , rude and unhelpful staff. It's like once they have got your money and in their hell hole of hotel they don't care what your query is. We were just taken to our rooms, not told about meal times, activities, who to contact etc .MOSQUITOS The hotel is riddled with mosquitos, never have I experienced this before at this level. We had all purchased mosquito repellents but the moment we got out from our rooms to the lobby they were everywhere. FOODThe food leaves alot to be desired... same lunch  dinner is served no variety at all. Hence why we ate out every evening despite being all inclusive. You'd think you can't go wrong with breakfast but that was so basic, even skipped that as i was sick of the tasteless omlette and doughnuts everyday.Please do not be decieved by how the hotel looks from the outside.... it is beautiful but it's a shambles from inside. CLEANLINESS The pools that were ""allocated"" for modest swimwear were filthy; leaves, plastic , wood floating around, not just 1 odd day everyday. Outside my room there was a travel cot that had been dumped there for the whole week I was there and had not moved. Dishes and cutlery left in the corridor and not cleared.  see pics attached THE LIFTIf you happen to be on the 3rd or 4th floor then you are gone... 1st day I climbed 8 sets of stairs to get to the 4th floor as the lift looked very unsafe  dangerous. There was no second door to close so you can see the bare brick, wires etc as you are going up.REVIEWS ON TRIPADVISORWe had actually read some reviews and chose the hotel however if you look at the British or should I say well written reviews they are mainly negative. We met a British family who shared the same views as us and hated every moment of being there. RACISTThe most bizarre experience of my life. I was told because of wearing modest swimwear there was a separate area for us where we would feel comfortable.  that was for me to decide not them Out of the 6 pools I paid for I was able to use only 1. However on most of the days there were women in bikinis in the modest swimwear pool... this was clearly double standards... whilst I wasn't allowed in the rest of the pools she was . Told the manager who didn't do much . ANIMATION TEAM  REMIND ME WHO ARE THEY  Having been to several different hotels we were dissappointed with the animation team. When you think it can't get worse it does.. They walked around asking every single person but our group, on one of the days I asked why do you single my family out His response was because you are Egyptian  I'm not Egyptian  and people don't usually join in esp women. Clear discrimination and making assumptions...So they presumed that every single brown faced person is Egyptian and don't like taking part in activities. Most ridiculous reason. They didn't even ask any of the children or men to join in if they presumed women would be offended. Maro was walking around with a clipboard and hounding the rest to join whilst we watched. They have no sense of logic or reasoning.. so better to give upNO WIFI There is no free WiFi as advertised on the website. You have to pay extra.Overall a very bad experience: Avoid unable to upload pics as it states only 10 pics  I only uploaded 4"
Hotel,https://www.tripadvisor.com/ShowUserReviewsg58019d596718r579283274CountryInnSuitesbyRadissonNewportNewsSouthVANewportNewsVirginia.html,Date of stay: May 2018,"Country Inn  Suites by Radisson, Newport News South, VA",United States,Virginia VA,Newport News,unknown,Racist company,"Very racist calling guests monkey and forcing them out! Dont visit this place and take your business to a no. Racist hotel. Sensitivity training isnt enough, its embedded in the culture for this hotel. It should shut down."
Hotel,https://www.tripadvisor.com/ShowUserReviewsg34341d1956345r586301574VillasofAmeliaIslandPlantationAmeliaIslandFlorida.html,Date of stay: June 2018,Villas of Amelia Island Plantation,United States,Florida FL,Amelia Island,unknown,Racist Staff and Incompotent Security,"Do NOT stay here if you are looking for good customer service! Kevin the supervisor is a racist. When I confronted Kevin for being racist he replied ""I'm going to report you for calling me a racist."" Like seriously! I know FL was a slave state but come on! Officer Farrow is a joke! Officer Farrow was sent to our neighbors room per our request to investigate a noise disturbance next door but was completely ineffective and offered no assistance. When we confronted him and asked him ""well isn't your job to protect and serve"" he replied ""no that is not our company policy."" Do not waste your money here. Please stay elsewhere!! I will be calling corporate Monday re our horrible treatment and particularly 'Supervisor' Kevin and 'Officer' Farrow"
Hotel,https://www.tripadvisor.com/ShowUserReviewsg187331d298411r482958796AltesFahrhausHamburg.html,Date of stay: May 2017,Altes Fahrhaus,Europe,Germany,Hamburg,unknown,"Appalling service, racist comments","Just wanted to have lunch at the restaurant. Extremely rude waitress, clearly not willing to serve foreigners. She did not notice that we understood her racist comments. Certainly not a place to go for,. We left without even being seated."
Hotel,https://www.tripadvisor.com/ShowUserReviewsg312589d7855728r337145030CliviaLodgeandConferenceCentreVanderbijlparkGauteng.html,Date of stay: December 2015,Clivia Lodge and Conference Centre,Africa,South Africa,Gauteng,unknown,"Management extremenly racist and rude, no fans in the rooms","Management:The manager of the location is one of the biggest racists I have ever met. He was rude to us from the very first moment he laid eyes on us until he kicked us out on the last day without the breakfast we had paid for. He called us ""you people"" so many times, I lost count. And, when we confronted him on his racism, he asked if we were going to ""assault"" him, as if black people automatically resort to violence.When we enquired about boat cruises, after seeing that the facility had 2 boats, he told us that their license had expired. We later found out from his staff that this was not the case.When we made the reservation, I called to enquire about braai facilities. I was told there were none. At no point, before our arrival, was I told that braaing was not allowed at the facility. We came with our own portable braai stand. We ensured that we braaied far away from the thatched roofs and organised fire extinguishers. The other guests also used our braai stand as they were also not aware of the situation with the braai. When we were getting ready to check out on the last day, the rude manager had confiscated our braai stand. He told us that ""you people have no respect"" said things like ""I don't want you people coming here and thinking you can do whatever you want"". He then proceeded to kick us off ""his premises"" without allowing us to have the breakfast we had already paid for.Facilities: The resort has thatched roofs and is located in the Vaal, a notoriously warm area. They did not have fans in any of the rooms. The beds did not have flat sheets in the beds so you struggled to sleep in the heat as you were forced to use the duvets and it was not. When the town ran out of ice and we purchased some from the resort, the racist manager proceeded to scream at his staff for selling ice to ""us people"". Only one pot on the stove was working. There is only one shower in the threebedroom chalet, so showering was a very long endeavour. The shower was blocked, flooded and sprayed water everywhere.Location and nonmanagerial staff: The resort is situated right by the river, with a nice view at the back. The staff was friendly and helping, with the exception of the manager. That is the only good thing I have to say about the resort.Stay away, especially of nonwhite."
Hotel,https://www.tripadvisor.com/ShowUserReviewsg312589d7855728r336578295CliviaLodgeandConferenceCentreVanderbijlparkGauteng.html,Date of stay: January 2016,Clivia Lodge and Conference Centre,Africa,South Africa,Gauteng,unknown,This is the worst lodge I have ever been to,"While the location is beautiful and the staff are friendly, cleanliness is mediocre at best and the owner is incredibly rude and disrespectful and kept referring to us 'you people', in addition to using many other racially charged terms. We were told that we cannot sit in certain areas of the premises, for no reason, there were no nearby Braai facilities, and while there is an onsite boat that is available for hire, we were told that we cannot make use of it for no legitimate reason. This place has a lot of potential but the owner, unfortunately, does not know how to treat his guests and turned this into a terrible experience!"
Hotel,https://www.tripadvisor.com/ShowUserReviewsg298033d315217r499496284LabernaHotelMarmarisMarmarisDistrictMuglaProvinceTurkishAegeanCoast.html,Date of stay: June 2017,Laberna Hotel,Europe,Turkey,Turkish Aegean Coast,unknown,Possibly the WORST in Marmaris,"This was definitely the worst hotel I've ever stayed at, they had everything from; out of date food, racism to physical assault, the full package. You're not allowed to bring in any food or drinks from outside the hotel as they want to be able to sell the same food/drinks at a much higher price to you. They do push you alot to buy meals from the hoteI. I bought breakfast thinking it will atleast be at a decent standard but what I got was beans on toast where you can see the toast had mould growing on the side crust. After that I didn't eat from the hotel again. I would honestly not recommend anyone buying food from the actual hotel. The hotel staff are incredibly rude and unprofessional. Many of the days when we had room servive clean up they would always forget towels. We went down to reception 3 times to ask for towels as each time they 'forgot' and recieved them about 2 hours later and one time we just got it ourselves from the room service people in the hall way. For some reason this hotel seems to have racism down as a normality among staff. The racist comments i heard against Asians, and Black people in particular were disgusting, they're too offensive to write here, but I'm still shocked, I could not believe the language that they were using. The lobby was the only place with wifi, three different days we went down at around 10 11 o'Clock pm to use the lobby wifi and the person there would turn off the router so we go back to our rooms and leave him there on his own. We'd be as quiet as possible but it was clear he just didn't want us there at all. No other hotel I've been to have ever treated customers like that. You have to pay 40 for air conditioning on top For 7days , even though nearly all of the other hotels near by have that as standard. We decided to buy the air conditioning anyway on the second day, and asked a different member of staff, who then bumped the price to 50. We were confused as they had already told us the price everyone pays so we spoke to a different person who said it was 40, then asked why this other guy said its 50. After speaking to him he said he was apparently just joking, which wasn't very funny to me...their hunger for money has blinded them from providing a decent level of customer service. Lastly I'm going to talk about physical assault. I went on this holiday with a group of friends, one of them litteraly got physically assaulted by the night manager in front of my eyes full on punches to the face and kick to his shin. Shocked is an understatement. It was a completely unprovoked attack mind you this particular night manager had previously made racist comments toward me and my friend earlier in the week. I've never witnessed such disgusting racist behaviour from any sort of hotel or even person before. If me or my friends didn't intervene the injuries to his face would've been much worse, the night manager then continued to threaten my friend. Saying that he won't be able to call the police because he 'was good friends with them' and 'they wont believe anything we say' and that 'he knows alot of people around here' and yes, these are his exact words. Being threatened in a country like Turkey was scarey and made us feel like there was nothing we can do, just take the assault and pray we make it home in one piece, this Hotel was clearly anything but safe. We had to even call the British Embassy, who sent over a rep to give us advise on what our options were. I don't wish that kind of treatment on anybody. Overall, this hotel is possibly one of the worst in Marmaris. There are alot of other hotels in the area with much better standards that cost nearly the same or just a little more with much better customer service and safety. For your own health, safety and security I would not recommend this hotel at all."
Hotel,https://www.tripadvisor.com/ShowUserReviewsg298033d315217r499495897LabernaHotelMarmarisMarmarisDistrictMuglaProvinceTurkishAegeanCoast.html,Date of stay: June 2017,Laberna Hotel,Europe,Turkey,Turkish Aegean Coast,unknown,Appauling and racist!! ,Wifi gets switched off after half 9 every night.Being abused by staff because we decided to eat out instead of purchasing the OVERPRICED food within the hotel! Staff would charge us to do the simplest things like take our towels.Ridiculous money grabbers.Would give 0 stars if there was that option. Do not take friends and family here. 
Hotel,https://www.tripadvisor.com/ShowUserReviewsg298033d315217r415273534LabernaHotelMarmarisMarmarisDistrictMuglaProvinceTurkishAegeanCoast.html,Date of stay: August 2016,Laberna Hotel,Europe,Turkey,Turkish Aegean Coast,unknown,Dont recommend,"I do not recommend this hotel if you are planning to stay at the hotel a lot. The location is great but one of the staff is racist and slightly sexist night staff in particular. On several occasions the night staff turned off the free WiFi. He was nicer to other Turkish guests and never complained when they would make noise, but whenever we spoke he would shout at us for talking too loud, bare in mind we were not speaking loudly. However there are some staff who are nice, the guy with the long hair at reception was lovely, also another young guy at the reception who doesn't speak much English. Also Vicky and her husband were lovely. I did not like the strict rule about how you were not allowed food from outside, but I do understand their reason for having this rule. I would definitely not stay at Laberna again as the way we were treated by a particular night staff member was completely unacceptable. We asked the day staff if we could arrange a meeting with the management about this but got nowhere. Also, when this same member of staff who was racist served us for breakfast he messed up our order and we were over charged. Overall, I wouldnt stay here again."
Hotel,https://www.tripadvisor.com/ShowUserReviewsg298033d315217r274636621LabernaHotelMarmarisMarmarisDistrictMuglaProvinceTurkishAegeanCoast.html,Date of stay: May 2015,Laberna Hotel,Europe,Turkey,Turkish Aegean Coast,unknown,Nav,"The hotel room itself, room 413, was actually really good and the bathroom and shower were adequate. But as for the staff, more so the big guy in tattoos who looks like he just got discharged from the marines, was just the most consistently, passive aggressive intimidating guy I've ever come across. On many many occasions, especially when trying to have my measly disappointing breakfast, id have him march up to myself and my friends complaining that we dont purchase drinks from the hotel and the hotel needs to make money esp in the off peak seasons. And as far as i was concerned, that was not non of their business where i chose to eat and drink during my visit. The breakfast was really crap, limited choices. Honestly it was better to have had nothing at all. And on the day of checkout, we got accused of taking one beer out of the mini fridge. And non of us even drink. So we disputed and apparently it was the house keeping staff that had made some ""mistake"", the same ""mistake"" they made moving my mates room key around which could have meant paying 50 for a replacement. Snide little F.....s. Anyhoo. The pool wasn't so bad, if you're over 6 foot that is. I would honestly say, stay clear from this hotel, especially if you are Asian. Clear hints of racism received. Enough to ruin ones holiday... "
Hotel,https://www.tripadvisor.com/ShowUserReviewsg58134d110752r631078058EconoLodgeCivicCenterRoanokeVirginia.html,Date of stay: November 2018,Econo Lodge Civic Center,United States,Virginia VA,Roanoke,unknown,Racists,"I didnt like anything about this hotel. The people who run the hotel are very racists and the dont allow guest of no type. My car was being worked on next door to them so I had my uncle pick me up for work and they had a problem with him pulling in to pick me up and made me leave the hotel due to me allowing my uncle to come inside my room to use the restroom. Check in is at 2pm and they didnt let me check in till 4pm due to the rooms wasnt cleaned yet. At check out they dont knock on your door to tell you its check out time or ask if you need anything they just walk in, like what if i was nude or something very disrespectful overall. They very racists."
Hotel,https://www.tripadvisor.com/ShowUserReviewsg664891d8559101r593094695TheStRegisMacaoCotaiCentralMacau.html,Date of stay: January 2018,"The St. Regis Macao, Cotai Central",Asia,China,Macau,unknown,"Great hotel, nice hotel staff","This place is located in the new town if you are looking for great food its better for you to stay at the opposite side of the river. Overall experience with this resort is great, especially with the nice hotel staff, but he casino security is simply horrible. They racial profiles and it just brings bad images to the hotel, and they should have to casino staff to the same standard as the hotel. As for the local food choice, you need to be very cautious with the local taxi driver as they will always trick you to go for the longer route across the bridge. When we asked the hotel staff about the local good dinning area and they gave us a name and tell us to just grab a taxi and it ends up the taxi driver lied to us that its not opened and suggest us to go across the bridge for better breakfast options. It was our first time and we didnt know any better. Overall the taxi was the worst experience we had in Macau, Overcharging and deceiving. Go for public transportation if you can. "
